{
  "$schema": "../../schemas/rest-arrow-adapter-vector-v1.schema.json",
  "schema_version": 1,
  "contract": "plenora-rest-arrow-adapter-vector-v1",
  "description": "No record: an empty table with the declared schema.",
  "declaration": {
    "schema_version": 1,
    "contract": "plenora-rest-arrow-adapter-v1",
    "accept_status": [
      "success"
    ],
    "on_record_error": "fail",
    "undeclared_members": "ignore",
    "fields": [
      {
        "name": "id",
        "field_id": 0,
        "pointer": "/id",
        "type": "int64",
        "nullable": false
      },
      {
        "name": "name",
        "field_id": 1,
        "pointer": "/name",
        "type": "utf8",
        "nullable": true
      },
      {
        "name": "score",
        "field_id": 2,
        "pointer": "/metrics/score",
        "type": "float64",
        "nullable": true
      },
      {
        "name": "active",
        "field_id": 3,
        "pointer": "/active",
        "type": "bool",
        "nullable": true
      }
    ]
  },
  "result": {
    "schema_version": 1,
    "status": "success",
    "output": {
      "type": "records",
      "records": []
    },
    "errors": []
  },
  "expect": {
    "outcome": "table",
    "rows": [],
    "excluded": [],
    "rest_status": "success",
    "rest_errors": 0
  }
}
