{
  "$schema": "../../schemas/rest-arrow-adapter-vector-v1.schema.json",
  "schema_version": 1,
  "contract": "plenora-rest-arrow-adapter-vector-v1",
  "description": "Just below 2^1024 - 2^970 the nearest binary64 is the largest finite one; -0.0 keeps its sign.",
  "declaration": {
    "schema_version": 1,
    "contract": "plenora-rest-arrow-adapter-v1",
    "accept_status": [
      "success"
    ],
    "on_record_error": "fail",
    "undeclared_members": "ignore",
    "fields": [
      {
        "name": "v",
        "field_id": 0,
        "pointer": "/v",
        "type": "float64",
        "nullable": false
      }
    ]
  },
  "result": {
    "schema_version": 1,
    "status": "success",
    "output": {
      "type": "records",
      "records": [
        {
          "v": 1.7976931348623158e308
        },
        {
          "v": -0.0
        }
      ]
    },
    "errors": []
  },
  "expect": {
    "outcome": "table",
    "rows": [
      {
        "v": 1.7976931348623157e+308
      },
      {
        "v": -0.0
      }
    ],
    "excluded": [],
    "rest_status": "success",
    "rest_errors": 0
  }
}
